Article Count,Article ID,Publication Date,Title,Keywords,Abstract
340,15756497,2005-03-10,[Liver and rheumatism].,N/A,"There are multiple relations between rheumatic diseases and the liver, nevertheless the liver is extremely rare involved in rheumatic diseases. ""Elevated liver enzymes"" are quite often found in patients who are under the medication with immunosuppressive drugs or/and non-steroidal antirheumatics. The most frequent cause for ""elevated liver enzymes"" are toxic and allergic side effects of drugs; however, in rare cases it might be extremely helpful to examine, whether an independent liver disease exists. Underlying liver diseases which might be associated with the rheumatic disorder or exist accidentally may change the therapeutic management of the patient. If the liver disease present can cause the rheumatic disorder (e. g. virus-induced vasculitis, hemochromatosis), a specific hepatological therapy should precede the immunosuppression."
341,15706920,2005-02-15,[Experimental research of effect of crude and processed Herba Siegesbeckiae on anti-inflammation and anti-rheumatism].,N/A,"To find out the specialities of the effect of crude and processed Herba Siegesbeckiae on anti-inflammation and anti-rheumatism.
Experiments were made on rats with swelling foot induced by carrageenin; experiments were made on mice with swelling ear induced by xylol; experiments were made on rats with chronic granuloma; experiments were made on rats with adjuvant arthritis.
Foot swelling induced by carrageenin could be diminished with crude and processed Herba Siegesbeckiae at 6.0, 2.0 g x kg(-1). The rate of inhibition of foot swelling was more than 40%, effect of the crude drug was better than that of the processed one; both of them at 6.0, 2.0 g x kg(-1) could protect rats from primary and continuous lesion of adjuvant arthritis. The effect of the processed herb was obviously better than that of the crude one in its starting minute, strength and sustaining time.
The processed Herba Siegesbeckiae has obvious inhibition effect on immune inflammation. It is better than the crude Herb. Both of them have obvious inhibition effect on inflammation caused by carrageenin, with no distinct difference."
342,15693099,2005-02-05,What is the impact of adolescent arthritis and rheumatism? Evidence from a national sample of Canadians.,N/A,"Adolescent arthritis or rheumatism (AAR) has been shown to influence the activities, mental health, and healthcare utilization of affected individuals. However, these effects have never been estimated in a population-based sample. We examined the association of AAR with health status, health services use, health behaviors, and activity limitations. We also investigated the effect of socioeconomic status and family background on respondents with AAR.
The 1996 National Population Health Survey is a nationally representative survey exploring the health status and behaviors of Canadians. Among the 26,012 individuals aged 12 to 19 with complete responses on the presence of chronic illnesses, the 213 self-reporting arthritis or rheumatism (AAR) were compared to: (1) all other adolescents as a single group; or (2) the group of 9161 adolescents reporting other chronic diseases (OCD) but not AAR, and the group of 16,638 adolescents without chronic disease (WCD). Between-group differences were examined for the following variables: health status; use of health services; presence of activity limitations in school, work, or at home; and school enrollment and work status.
Compared to those without, respondents with AAR reported more diagnoses of non-AAR chronic illnesses. Depression among AAR individuals was more prevalent than among non-AAR individuals, as was suffering from moderate or severe pain. Those with AAR were more likely than WCD individuals to use physician services, hospital services, and pain relief medications. AAR patients were more likely to be limited in their activities, and less likely to be enrolled in school than OCD or WCD individuals.
This study indicates a broad range of effects of AAR in a nationally representative sample. Arthritis or rheumatism affected measures of mental health, health service use, and the school, work, and home activities of affected individuals, compared to individuals without chronic disease or with other chronic disease."
343,15454124,2004-09-30,Palindromic rheumatism and other relapsing arthritis.,N/A,"Patients with recurrent or relapsing arthritis are frequently seen in rheumatological practice. Besides crystal arthritis, the most frequent cause of recurrent arthritis, there are several diseases that may present clinically as intermittent mono- or polyarthritis. Palindromic rheumatism is the paradigm of this type of condition, but other diseases such as systemic autoinflammatory disorders (periodic fever syndromes), Whipple's disease, arthritis associated with hyperlipidemia, intermittent hydrarthrosis and other diseases should be taken into account in the differential diagnosis of patients with recurrent arthritis. In this chapter, we discuss recent developments in these diseases with special emphasis on palindromic rheumatism, a common condition whose close relationship with rheumatoid arthritis remains intriguing."
344,15168987,2004-06-01,Soft tissue rheumatism.,N/A,"Soft tissue rheumatism includes disorders of tendons and their sheaths, ligaments, bursae, joint capsules, muscles, fasciae and others. Inflammatory signs or systemic manifestations may be lacking in these disorders. Fibrositis, bursitis, tenosynovitis, myositis are some of the common types of soft tissue rheumatism. The disorders can be classified broadly into two groups ie, diffuse and local. Proper history taking and performing detailed examination are very important in arriving at diagnosis. Management includes pain relief by suitable measures. In fibromyalgia diffuse musculoskeletal pain is observed having at least 11 or 18 tender points involving upper and lower body bilaterally."
345,15049603,2004-03-31,[Psoriatic rheumatism].,N/A,"Five to 7% of patients with cutaneous psoriasis suffer from inflammatory rheumatism that is sero-negative for rheumatoid factor, and is often erosive. The inflammation is predominant to the entheses and can affect the axial or peripheral skeleton, often in an associated manner. The most common peripheral signs are those of an asymmetrical oligo-arthritis type, and the most evocative are arthritis of the distal inter-phalangeal joints. A symmetrical polyarthritis can also be observed. The severe mutilating forms are fortunately very rare. Axial signs include sacro-iliitis that is more often bilateral and spinal involvement of an ankylosing spondyloarthitic type, predominating in the cervical and thoracic spine. The treatment usually calls for a non-steroidal anti-inflammatory and local injection of cortisone. Steroids must be used with care and reserved for the severe forms. DMARDS include Salazopyrin, methotrexate, and in the severe and resistant forms, the inhibitors of TNFalpha."
346,14994925,2004-03-05,[Phenobarbital rheumatism associated with gouty arthritis. Case report with 18-month follow-up].,N/A,"Anticonvulsivant-induced rheumatism has been described in the literature mostly in relation to phenobarbital therapy. We report the case of an 85-year-old male affected by generalized seizures and treated with phenobarbital for some months, who came to our observation on account of a long-lasting arthropathy which was diagnosed as unknown gouty arthritis. After treatment however, a clinical picture of shoulder-hand syndrome persisted: this latter disappeared after substitution of phenobarbital with phenytoin. The association of a syndrome of rheumatism induced by barbiturates with gouty arthritis has not been previously described in the literature."
347,14979931,2004-02-26,The 4th annual European League Against Rheumatism congress in Lisbon: a personal perspective.,N/A,"The 4th annual European League Against Rheumatism congress, held in Lisbon, 18-21 June 2003, had a record turnout of more than 8600 delegates and the abstract submissions increased to 2600. A heat wave and a somewhat substandard venue hampered some of the activities, notably the poster sessions. The scientific program was comprehensive and of a high class, and it was organized in 10-12 parallel sessions. The European League Against Rheumatism standing committees are expanding their activities and stimulating European cooperation (e.g. by creating databases and guidelines, and by starting research programs). The standing committees presented several areas where European cooperative work is in progress. Advances in drug therapy were a prominent theme and were well presented. Commercialism remains a problem for this meeting as for other similar large meetings, where satellite symposia surround the scientific program of the congress and often duplicate this."
348,14677195,2003-12-17,Leisure-time physical activity patterns and relationship to generalized distress among Canadians with arthritis or rheumatism.,N/A,"Little is known about the epidemiology and possible mental health benefits of leisure-time physical activity (LTPA) for persons with arthritis and other rheumatic conditions. We examined the prevalence of LTPA and its association to generalized distress among Canadians with rheumatic conditions.
The 1996-97 National Population Health Survey interview data from respondents with rheumatic conditions (n = 10,700) and persons with no chronic conditions (n = 19791) in the same age range (20-79 yrs) were selected for analyses. Self-reported data on forms and frequency of LTPA engaged in over the past 3 months were collected. Intensity of LTPA was expressed as total energy expenditure, with respondents classified as Active (> or = 3.0 kcal/kg/day), Moderate (1.5-2.9 kcal/kg/day), and Inactive (< 1.5 kcal/kg/day). Generalized distress was assessed using a subset of items from the Composite International Diagnostic Interview.
Similar to persons with no chronic conditions, roughly 56% of persons with rheumatic conditions engaged in regular LTPA (12 or more 15-minute sessions per month). Only 13.2% of women and 18.9% of men with rheumatic conditions were sufficiently active at the level recommended to yield optimal health benefits. Both moderate and higher intensity LTPA was associated with less generalized distress. This relationship was more pronounced for women and for middle-aged and older patients with rheumatic conditions.
A significant proportion of Canadians with rheumatic conditions are physically inactive. Even moderate intensity LTPA is associated with decreased generalized distress. Better efforts must be directed at promoting LTPA as part of the multidisciplinary management of this condition."
349,14603579,2003-11-08,Guidelines for management of osteoarthritis published by the American College of Rheumatology and the European League Against Rheumatism: why are they so different?,N/A,"Because of different methodology the ACR and EULAR guidelines differ significantly in their recommendations despite an identical evidence base. Guidelines that use a strictly evidence-based approach are less likely to incur bias than those that rely more on expert consensus. Although expert consensus is useful in areas in which there are little trial data, clear delineation should be made between evidence-based statements and expert opinion. Following the dissemination of guidelines for the management of OA, emphasis should now be placed on discussion and implementation of the recommendations and subsequent revision of guidelines as new evidence comes to light."
350,14598662,2003-11-06,[A case of Poncet's disease (tuberculous rheumatism) in a patient with chronic renal failure undergoing hemodialysis therapy].,N/A,"A 78-year-old man who was undergoing hemodialysis therapy was admitted to our hospital because of sore throat, remittent cervical lymphadenopathy, and polyarthritis over the preceding 4 weeks. On admission, he had bilateral cervical lymphadenopathy. He complained of arthralgia associated with tenderness, warmth and swelling of both elbows, left side wrist and left shoulder joint. The C-reactive protein level on admission was 15.3 mg/dl. Rheumatoid factor, antinuclear antibodies, tuberculin skin test and blood culture were negative. Joint fluid was not aspirated. Radiographs of the joints did not reveal any abnormalities. Acid-fast bacilli were demonstrated in the smear of the cervical lymph node with a fluorochrome rhodamine-auramine stain. Mycobacterium tuberculosis DNA was identified by polymerase chain reaction. We found the presence of caseating granuloma on the biopsy specimens and M.tuberculosis was detected from culture. At that point, we diagnosed this patient as having tuberculous lymphadenitis. His general symptoms resolved rapidly after starting with a three-drug regimen consisting of isoniazid, rifampin and pyrazinamide. His polyarthritis also improved dramatically. Finally we considered that his polyarthritis was tuberculous rheumatism, also called Poncet's disease. Poncet's disease is characterized by sterile polyarthritis during active tuberculosis infection. It is considered a reactive arthritis, which is a different entity from tuberculous arthritis. Although this is a rare disease, we should be aware of it in hemodialysis patient clinics, because the incidence of tuberculosis infection has been reported to be increasing in patients with end-stage renal failure."
351,14514418,2003-09-30,Proliferation characteristics and polyploidization of cultured myofibroblasts from a patient with fibroblastic rheumatism.,N/A,"Fibroblast-like cells were obtained from a nodule of a patient with fibroblastic rheumatism, and grown in culture for different times (from passage 3 to 21). These cells as well as the fibroblasts taken from an unaffected skin area (controls) of the same patient, have been investigated by fluorescence microscopy, cytochemical methods and cytometry, to evaluate their cytodifferentiation features and cytokinetic characteristics. In addition, in low-passage cultures, the secretion of collagen and of non-collagenic proteins was evaluated using electrophoretic techniques. The immunolabeling with antibodies against sm-specific a-actin (which was taken as a marker of myofibroblasts) showed that, already in low-passage cultures, the percentage of myofibroblasts was higher in the nodule-derived cell populations, and progressively increased with increasing passages. This suggests that myofibroblasts have higher proliferation potential than control fibroblasts. Myofibroblasts were also found to undergo polyploidization and hypertrophy, especially in high-passage cultures. Based on these results, it may be hypothesized that in fibroblastic rheumatism the development of the typical nodules could depend on the intrinsic capability of myofibroblats of proliferating faster than normal fibroblasts and of becoming polyploid and hypertrophic. Nodule-derived cells in culture synthesized slightly less collagen and non-collagen proteins than did the control fibroblasts; this suggests that the increased fibrosis observed in nodules in situ could be likely dependent on a reduced degradation of the extracellular matrix components."
352,12926659,2003-08-21,The role of user representation and Arthritis and Rheumatism International.,N/A,"Arthritis and Rheumatism International (ARi), founded in 1988, is an association of national lay organizations comprising mainly people whose lives are affected by arthritis and rheumatism. ARi's charter defines the organization's aims, including to raise awareness of the needs of people with arthritis/rheumatism, to improve the quality of their lives through education and self-management programs, and to support research into causes, management, prevention, and cure of arthritis. With the aid of a grant from the Pfizer Foundation in 2002, ARi has been able to further develop into a strong organization throughout the world, with a membership of 22 countries. Successful intitiatives include the People with Arthritis and Rheumatism in Europe Manifesto, which has served as a very effective focus for developing action plans, opening dialogues, building partnerships with other organizations, lobbying governments, and gaining media attention throughout Europe. The manifesto (website: www.PAREmanifesto.org) was developed by ARi working in conjunction with The International Organisation of Youth with Rheumatism and the EULAR Social League. These are examples of initiatives that ARi aims to promote on a global scale in the next few years."
353,12926655,2003-08-21,Bone and joint disease around the world. The Japan Rheumatism Friendship Association.,N/A,"The Japan Rheumatism Friendship Association (JRFA) was founded in 1960 and today has a membership of about 23,000, with 47 chapters across the country. We periodically conduct a survey of our membership for the Rheumatism White Paper, which we have been publishing since the JRFA was formed. The entire membership is surveyed every 5 years; surveys give an accurate picture of the current state of the disease and reflect the fundamental activities of the JRFA; they shed light on progress in developing effective measures against arthritis, and give people a better understanding of rheumatism. The survey is also a unique resource, for it canvasses a wide cross section of people with arthritis. In Japan, the Rheumatism White Paper is widely regarded as an authoritative source. The aims of the JRFA are to promote the accurate knowledge of RA to improve mutual friendship, and to work for the establishment and development of policies against RA disease. In this way, the JRFA seeks to advance the welfare of RA patients. In this article the activities of the JRFA are described."
354,12906020,2003-08-09,Etanercept: new preparation. Useful after methotrexate failure in inflammatory rheumatism.,N/A,"There is no reference second-line treatment for patients with rheumatoid arthritis, juvenile chronic arthritis, psoriatic arthropathy or ankylosing spondylitis after failure or intolerance of a slow-acting antirheumatic drug such as methotrexate. Etanercept, a immunosuppressant targeting TNF-alpha (like infliximab), is now approved in France for use in these situations, with the exception of spondylitis. In the second-line treatment of adults with rheumatoid arthritis, the clinical evaluation dossier on etanercept contains data from dose-finding studies and two placebo-controlled trials involving patients in whom several single-agent treatments had failed. At a dose of 25 mg subcutaneously twice a week, etanercept worked partially in about half the patients. Without direct comparisons, the place of etanercept relative to other slow-acting antirheumatic drugs is difficult to establish. From indirect comparisons, etanercept seems a slightly better treatment option than infliximab. In the first-line treatment of rheumatoid arthritis, one trial showed that etanercept worked faster than methotrexate, but there was no significant difference between the two treatments after two years. Little is known about the efficacy of etanercept in patients with juvenile chronic arthritis who do not respond adequately to methotrexate. There are no comparative trials. One double-blind placebo-controlled trial showed that etanercept, when it worked, remained active for at least 7 months. In one trial, etanercept was more effective than placebo in patients with psoriatic arthropathy and ankylosing spondylitis who continued to receive their usual treatment, which included a slow-acting antirheumatic drug in about 50% of cases. More than 50% of patients treated with etanercept have a cutaneous reaction to the injection. These reactions are usually mild or moderate. Active pharmacovigilance is needed, given its mechanism of action, and previous notifications of a wide variety of adverse effects (even though it is sometimes difficult to establish a foolproof link between etanercept and the adverse effect). Long-term studies of large numbers of patients are needed to determine the precise risk of side effects including haematological, infectious, neurological, oncological and immunological effects. In practice, methotrexate remains the first-line treatment for inflammatory arthritis. Etanercept can be a useful second-line treatment, especially in juvenile chronic arthritis."
355,12892555,2003-08-02,[Indifferentiated rheumatism and/or epileptic flatulence].,N/A,"A clinical case study of a 50 year-old woman brought to the Rhematology Department is presented, who showed clinical dry syndrome with immune disorders (not currently defined) and developed tumors (benign at present) and analytical autoimmunity with positive antitopoisomerase type I (formerly Scl70) confirmed. The clinical case is commented and the metheorism causes are discussed, among it, a possible variation of abdominal epilepsy as ictal flatulence, secondary to a meningioma of the right brain convexity."
356,12870386,2003-07-23,[Hyperthyroid rheumatism. Review of the literature and a case report].,N/A,"It is extremely rare that an inflammatory rheumatism reveals a hyperthyroidism. Only six observations have been described. We report a case of rheumatismal hyperthyroidism successfully treated with carbimazole and propranolol.
A 52 year-old woman presented with inflammatory rheumatismal pain predominating at the waist for the past six months and resistant to synthetic anti-inflammatories. Thyroid hormone analysis permitted diagnosis of hyperthyroidism. Initiation of treatment with carbimazole led to the rapid regression of the rheumatismal manifestations.
Hyperthyroidism is classically manifested by signs of hypercatabolism. Osteoarticular manifestations are dominated by humeroscapular periarthrosis. Rheumatismal hyperthyroidism is characterised by inflammatory rheumatismal pain evoking, as in our patient, a rhizomelic pseudo-polyarthritis. The outcome, whatever the anti-thyroid treatment, is always good. The physiopathological mechanisms are unknown. They may be due to an attack of the antibodies against the synovial and/or cartilage structures, or to the effect of propranolol.
It is important to underline the interest of thyroid hormone assay in cases of dubious etiological inflammatory rheumatism and/or resistant to classical treatments."
357,12730510,2003-05-06,Prevalence and clinical significance of anti-cyclic citrullinated peptide and antikeratin antibodies in palindromic rheumatism. An abortive form of rheumatoid arthritis?,N/A,"To analyse the prevalence and clinical significance of anti-cyclic citrullinated peptide antibodies (anti-CCP) and antikeratin antibodies (AKA) in patients with palindromic rheumatism (PR).
Sixty-three patients with PR were included: 33 were defined as pure or persistent PR at the time of serum test measurement, and 30 as associated PR, defined as patients with past history of PR who had developed persistent arthritis at the time of serum test: [21 with rheumatoid arthritis (RA)]. Sixty patients with early RA, and 80 with seronegative spondyloarthropathy were included as control groups. Anti-CCP were determined by a standardized ELISA test and AKA by indirect immunofluorescence in rat oesophagus. Clinical characteristics of these pure PR patients were compared according to the presence or absence of anti-CCP antibodies. A follow-up study was also performed.
Anti-CCP were detected in 18 out of 32 (56.3%) patients with pure PR and 10 out of 30 (33.3%) with associated PR (38.1% in RA-associated PR patients). AKA were detected in 12 patients out of 33, with pure PR (36.4%), and in 9 out of 30 with associated PR (30%) (33.3% in RA-associated PR patients). The prevalence of anti-CCP and AKA in the RA control group was 55% (not significantly different from the pure PR group) and 61.7% (with respect to pure PR patients, P=0.02), respectively. In the spondyloarthropathy group, the prevalence of anti-CCP and AKA was 2.5 and 3.8%, respectively (P<0.001 compared with pure PR patients). No significant clinical differences were observed between pure PR patients with and without CCP antibodies.
Anti-CCP and, to a lesser extent, AKA, were found in a high proportion of patients with PR, suggesting that this syndrome is an abortive form of RA. The predictive value of these antibodies in PR, as markers of progression to an established RA, remains uncertain."
358,12666303,2003-04-02,[Eight cases of rheumatism associated with cancer].,N/A,"To study the rheumatic diseases associated with cancer diagnosed in an Internal Medicine Service.
A retrospective and descriptive study of the patients diagnosed during 1992-2000 of different rheumatic diseases associated with cancer.
During a period of 9 years we identified 8 cases of paraneoplastic rheumatisms about a total of 2,127 patient, representing an incidence of 3.7@1000, with a predominance in males. The consultation motive in all them was the clinic of the rheumatic disease. Six of the eight neoplasias were adenocarcinomas.
Though the paraneoplastic rheumatisms are not frequent, it is necessary take into account their existence when exist antecedent of neoplasia, in patient male and when the clinical course or response to the treatment is atypical."
