Article Count,Article ID,Publication Date,Title,Keywords,Abstract
104,31371648,2019-08-03,Rheumatoid Arthritis Initiating as Palindromic Rheumatism: A Distinct Clinical Phenotype?,"ANTICARBAMYLATED PROTEIN ANTIBODIES"", ""ANTICITRULLINATED PROTEIN ANTIBODIES"", ""HYDROXYCHLOROQUINE"", ""PALINDROMIC RHEUMATISM"", ""RHEUMATOID ARTHRITIS"", ""SMOKING","To analyze the prevalence of preexisting palindromic rheumatism (PR) in patients with established rheumatoid arthritis (RA) and to evaluate whether these patients have a distinctive clinical and serological phenotype.
Cross-sectional study in patients with established RA. Preexisting PR was determined using a structured protocol and confirmed by retrospective review of medical records. Demographic, clinical, radiological, immunological, and therapeutic features were compared in patients with and without PR.
Included were 158 patients with established RA (78% female) with a mean disease duration since RA onset of 5.1 ± 2.7 years. Preexisting PR was recorded in 29 patients (18%). The median time from the onset of PR to progression to RA was 1.2 years. No between-group differences in demographic features, current disease activity, radiographic erosive disease, or disability were observed. Patients with PR had a higher prevalence of smoking (72% vs 40%). Positive rheumatoid factor, anticitrullinated peptide antibodies, and anticarbamylated protein antibodies were numerically higher in patients with PR. No differences in treatment were observed except for greater hydroxychloroquine (HCQ) use in patients with PR (38% vs 6%). Palindromic flares persisted in a significant proportion of patients during the RA course, including patients in clinical remission or receiving biological disease-modifying antirheumatic drugs.
Eighteen percent of patients with RA had a history compatible with PR previous to RA onset. No specific clinical or serological phenotype was identified in these patients, although higher HCQ use and smoking prevalence were identified. Palindromic flares may persist during the RA disease course despite treatment."
105,31340948,2019-07-26,Pitfalls in diagnosing geriatric general pain: coexistence of polymyalgia rheumatism and fibromyalgia.,"fibromyalgia"", ""geriatric medicine"", ""musculoskeletal syndromes"", ""orthopaedics"", ""pain","Polymyalgia rheumatism and fibromyalgia are clinically similar. As there are no specific diagnostic markers, they are difficult to distinguish. A 92-year-old woman with a 3-month history of general pain, including left hip pain, was referred to our hospital. Her medical history included polymyalgia rheumatism that had been treated with prednisolone for 18 years. We found 14 of 18 symmetrical tender points. We diagnosed fibromyalgia based on two physical examinations and her personal history of general pain. Pregabalin was prescribed, and her pain gradually disappeared. About a month later, she complained of returned buttock pain and fever. She was diagnosed with exacerbation of polymyalgia rheumatism by various examinations and was treated with prednisolone. We found 3 of 18 asymmetrical tender points. No symptoms had recurred at the 1-month follow-up visit. Her case provides an opportunity to highlight the possible pitfalls when diagnosing geriatric general pain."
106,31286192,2019-07-10,[Rheumatological care in the Rheumazentrum Ruhrgebiet Rheumatism Center-a model for conurbations].,"Complex therapy"", ""Inpatient care"", ""Outpatient care"", ""Quality"", ""Treat-to-target","The Ruhrgebiet Rheumatism Center, which is highly specialized for rheumatic diseases, is the largest of its kind in Germany. For many years it has fulfilled all the requirements for structural quality required by the Association of Rheumatological Acute Clinics (VRA) including regular participation in the KOBRA benchmarking project. Therefore, the center regularly receives the VRA seal for quality of care. In 2018 more than 7500 patients were treated as inpatients. Within the framework of care according to §116b (ASV since May 2019) there were nearly 25,000 outpatient patient contacts. Furthermore, an early screening program (triage) was established 5 years ago in order to be able to identify patients with musculoskeletal complaints on a potentially inflammatory rheumatic basis. This functions in the sense of an early diagnosis and treatment in accordance with the treat-to-target concept within less than 4 weeks (initially) on an outpatient basis with respect to the required urgency, in order to subsequently provide sound diagnostic support. In the last 2 years 2017 and 2018, this deadline was met in more than 90% of cases. Within the scope of inpatient care approximately one third of patients were treated in recent years with a defined rheumatological complex therapy and 10% with pain complex therapy. Approximately 3% were treated with geriatric complex therapy and 65% were short-stay patients (<4 days), i.e. patients who received the necessary diagnostics and treatment on an inpatient basis at short notice. The overall structure of the rheumatism center, the cooperation with rheumatologists in private practice, many cooperation partners, referring physicians and patients represents a model for rheumatological care in large conurbations. The care of large numbers of patients also enables the further training of many assistants and this is essential for the future of good rheumatological medicine."
107,31254454,2019-06-30,Incorporation of Salivary Gland Ultrasonography Into the American College of Rheumatology/European League Against Rheumatism Criteria for Primary Sjögren's Syndrome.,N/A,"To assess whether the addition of salivary gland ultrasonography (SGUS) or replacement of current criteria items by SGUS influences the performance of the American College of Rheumatology (ACR)/European League Against Rheumatism (EULAR) criteria for primary Sjögren's syndrome.
Included were consecutive patients with complete data on all ACR/EULAR items (n = 243) who underwent SGUS in our primary Sjögren's syndrome expertise center. Clinical diagnosis by the treating physician was used as the gold standard. Separate analyses were performed for patients who underwent labial or parotid gland biopsies. The average score for hypoechogenic areas in 1 parotid and 1 submandibular gland was determined (range 0-3). Next, performance of the ACR/EULAR criteria was evaluated after addition of SGUS or replacement of current items by SGUS.
Receiver operating characteristic analysis showed an optimal cutoff value of ≥1.5 for SGUS. The optimal weight for SGUS positivity was 1. Cutoff for ACR/EULAR fulfilment remained ≥4. In patients who underwent a labial gland biopsy (n = 124), the original criteria showed an area under the curve (AUC) of 0.965, sensitivity of 95.9%, and specificity of 92.2%. After the addition of SGUS, the AUC was 0.966, with a sensitivity of 97.3% and specificity of 90.2%. In patients who underwent a parotid gland biopsy (n = 198), similar results were found. Sensitivity of the criteria decreased substantially when SGUS replaced salivary gland biopsy or anti-SSA antibodies, while performance remained equal when SGUS replaced the ocular staining score, Schirmer's test, or unstimulated whole saliva flow.
Validity of the ACR/EULAR criteria remains high after incorporation of SGUS. With SGUS, clinicians are offered a larger array of tests to evaluate fulfillment of the ACR/EULAR criteria."
108,31197458,2019-06-15,[Three years of the appointment service office: high rate of false referrals and no show patients-A retrospective anaysis of the Rheumatism Center Schleswig-Holstein Mitte].,"Appointment service office"", ""Medical care"", ""Rheumatology"", ""Specialist practice"", ""Statutory health insurance","This article presents a retrospective analysis of patients who attended a rheumatology specialist practice (with two specialist rheumatologists) between 2016 and 2018 via an appointment arranged by the appointment service office (Terminservicestelle, TSS). Patients were analyzed in a pseudonymized manner and categorized according to the following criteria: 1. patient did not keep the appointment, 2. patient had no inflammatory rheumatic disease, 3. patient suffered from an inflammatory rheumatic disease but had no urgent indications to be seen and 4. patient suffered from an inflammatory rheumatic disease with urgent indications to be seen. Since the start of the TSS at the beginning of 2016 until the end of 2018 a total of 103 patients were allocated to this specialist practice via the TSS. An appointment was offered to 102 patients who underwent further analysis: 4.9% of the patients (n = 5) suffered from an acute inflammatory rheumatic disease and had urgent indications to be seen, 18.63% of patients (n = 19) suffered from an inflammatory rheumatic disease with no urgent indications to attend, 28.43% of patients (n = 29) did not keep the appointment and 48.04% of patients (n = 49) did not have an inflammatory rheumatic disease but other diseases, such as osteoarthritis, fibromyalgia and other forms of chronic pain syndromes. The positive predictive value (PPV) for patients with inflammatory rheumatic disease and urgent indications was 0.05 when all patients were included in the analysis and 0.07 when only patients who showed up were included. This retrospective analysis demonstrates that the TSS does not fulfill its purpose, namely to promptly arrange appointments at a specalist rheumatologist practice for patients with an acute inflammatory rheumatic disease."
109,31172694,2019-06-07,Performance of the 2015 American College of Rheumatology/European League against Rheumatism Classification Criteria for Gout in Korean Patients with Acute Arthritis.,"Classification Criteria"", ""Gout"", ""Monosodium Urate"", ""Sensitivity"", ""Specificity","We aimed to assess the performance of the 2015 American College of Rheumatology (ACR)/European League Against Rheumatism (EULAR) classification criteria for gout in Korean patients with acute arthritis and to compare the performance of the ACR/EULAR criteria to that of other sets of criteria for gout classification.
Patients with acute arthritis who underwent diagnostic arthrocentesis at one of the four participating rheumatology clinics were consecutively enrolled between February and December 2017. Crystal-proven gout was diagnosed upon confirming the presence of monosodium urate (MSU) crystals in patients with a clinical impression of gout as judged by the rheumatologist. The performance of the ACR/EULAR and other gout classification criteria, including the Rome, New York, American Rheumatism Association (ARA), Mexico, and Netherlands criteria, was analyzed regardless of the presence/absence of MSU crystals.
The study enrolled 118 gout patients (all crystal-proven) and 95 non-gout patients. According to the area under the curve, the diagnostic performance was the highest for the ACR/EULAR classification criteria (sensitivity, 80.5%; specificity, 95.8%; area under the curve, 0.966), followed by the Netherlands, Rome, ARA, New York, and Mexico criteria. All six sets of criteria demonstrated lower sensitivity in patients exhibiting the first episode of acute arthritis.
In Korean patients with acute arthritis, the ACR/EULAR classification criteria outperformed other sets of gout classification criteria even in the absence of information regarding the presence of MSU crystals. However, to enhance diagnostic sensitivity, synovial fluid analysis should be considered in patients with the first episode of acute arthritis."
110,31171010,2019-06-07,"Relapsing periodic arthritis, palindromic rheumatism and MEFV gene-related variants alleles in children.","FMF-related arthritis"", ""MEFV gene"", ""Palindromic rheumatism"", ""Recurrent synovitis of hip","Relapsing periodic arthritis is a general term used for a group of diseases with recurring and periodic nature, in which the joints are intermittently involved. The aim of this study is to evaluation of the possible relationship between MEFV gene mutations in intermittent arthritis of children which has recurring and periodic nature.
In this cross-sectional study we reviewed medical records of all patients with recurrent and periodic arthritis referred to pediatric rheumatology clinic from 2003 to 2019.We excluded all patients with suspicious anamnesis and/or positive history of FMF, JIA, gout, psoriasis, IBD and SLE. The peripheral blood of these patients was screened for the 12 common pathogenic MEFV gene variants (FMF Strip Assay, Vienna lab, Vienna, Austria) according to manufacturer's instructions.
Among 195 recorded files, 11 patients were identified with idiopathic recurrent and periodic feature. 3 patients suffering from recurrent transient synovitis hip (RSH) and 8 patients were fully compatible with the Pasero and Barbieri modified criteria of palindromic rheumatism (PR). Their mean age at diagnosis was 6.5 and 4.6 years and the average follow-up was 2.6 and 6.6 years in PR and RSH patients, respectively. The most frequently involved joints were knees and ankles in PR patients. The mean duration of attacks was 3.3 days in RSH patients and with various courses in PR. The median number of attacks was 4.75 in PR and 3 in RSH patients per year. In PR group 7 patients showed no mutations and all patients of RSH had these mutations; V726A, R761H, A744S as in heterozygote pattern.
An idiopathic relapsing periodic arthritis in children with exclusively hip involvement is a MEFV gene related arthropathy; whereas with various joint attacks it could be considered as childhood PR."
111,31167758,2019-06-07,2018 updated European League Against Rheumatism evidence-based recommendations for the diagnosis of gout.,"epidemiology"", ""gout"", ""health services research","Although gout is the most common inflammatory arthritis, it is still frequently misdiagnosed. New data on imaging and clinical diagnosis have become available since the first EULAR recommendations for the diagnosis of gout in 2006. This prompted a systematic review and update of the 2006 recommendations. A systematic review of the literature concerning all aspects of gout diagnosis was performed. Recommendations were formulated using a Delphi consensus approach. Eight key recommendations were generated. A search for crystals in synovial fluid or tophus aspirates is recommended in every person with suspected gout, because demonstration of monosodium urate (MSU) crystals allows a definite diagnosis of gout. There was consensus that a number of suggestive clinical features support a clinical diagnosis of gout. These are monoarticular involvement of a foot or ankle joint (especially the first metatarsophalangeal joint); previous episodes of similar acute arthritis; rapid onset of severe pain and swelling; erythema; male gender and associated cardiovascular diseases and hyperuricaemia. When crystal identification is not possible, it is recommended that any atypical presentation should be investigated by imaging, in particular with ultrasound to seek features suggestive of MSU crystal deposition (double contour sign and tophi). There was consensus that a diagnosis of gout should not be based on the presence of hyperuricaemia alone. There was also a strong recommendation that all people with gout should be systematically assessed for presence of associated comorbidities and risk factors for cardiovascular disease, as well as for risk factors for chronic hyperuricaemia. Eight updated, evidence-based, expert consensus recommendations for the diagnosis of gout are proposed."
112,31076945,2019-05-12,Efficacy of rituximab in resistant palindromic rheumatism: first report in literature.,"Palindromic rheumatism"", ""Rheumatoid arthritis"", ""Rituximab"", ""csDMARDs","Rituximab (RTX) provides significant clinical benefits in active rheumatoid arthritis (RA) patients with inadequate response to DMARDs and anti-TNF. There is no data regarding efficacy of RTX in seropositive Palindromic Rheumatism (PR), a forerunner of RA.
To determine the efficacy and safety of RTX treatment in active PR patients exhibiting inadequate response to conventional synthetic DMARDs (csDMARDs).
The retrospective study, over a period of 3 years, included seropositive (RF ± antiCCP) PR patients with inadequate control of PR (> 4 attacks per months) despite combination csDMARDs and were treated with RTX. All the patients were treated with an initial dose of 500 mg RTX and later with a second infusion after 2 weeks' period in those who did not achieve adequate/ complete disease control. Patients were continued on csDMARDS and retreated with RTX on relapse of symptoms.
Thirty-three seropositive PR patients with a mean age of 48.15 ± 14.2 years, mean disease duration of 68.4 ± 68.2 months, mean follow up period of 24.3 ± 10.8 months, were treated with RTX. 88% patients were on combination DMARDS and 79% patients were females. All patient achieved rapid and complete control of palindromic attacks with RTX. Fifteen patients had a relapse after a mean duration of 10.4 ± 5.5 months and needed repeat RTX infusions following which remission was achieved. None of the patients progressed to RA till the end of the follow-up. No serious adverse effects were recorded.
RTX treatment could be effective in achieving disease control in active palindromic rheumatism not responding to csDMARDs.
• PR is thought to be a forerunner of RA and rituximab (RTX) has been found to be effective in RA. • Our study supports the hypothesis that B cells play an important role in the pathophysiology of PR and that the combination (RTX+ conventional drugs) can prevent the disease evolution into RA. • This 3-year retrospective study showed that rituximab was found to be effective in those who responded poorly to conventional drugs and remission was achieved in all patients. • Although it is a rare disease, we see palindromic rheumatism patients in India more often. As the symptoms are very debilitating in these patients, in those patients, not controlled on conventional drugs, rituximab offers newer promise in controlling the attacks and prevents further progression to RA."
113,31016369,2019-04-25,[Depressive symptoms in early rheumatoid arthritis : Within the rheumatism network ADAPTHERA].,"ADAPTHERA"", ""DAS28"", ""HAQ"", ""PHQ-9"", ""WHO-5","For patients with established rheumatoid arthritis and also early arthritis an increased prevalence of depression has been described. For a better understanding of depression in early arthritis patients, depression prevalences of a German early arthritis cohort were examined, with a focus on disease activity, anti-CCP status, disease duration and functional capacity over a period of 2 years.
The evaluation was based on the early arthritis cohort ADAPTHERA from Rhineland-Palatinate. The inclusion criterion was a symptom duration before diagnosis of a maximum of 1 year. Data from the disease activity score 28 (DAS28), the Health Assessment Questionnaire (HAQ, functional status), the WHO-5 Well-Being Index (WHO-5, well-being and depressive symptoms) and the Patient Health Questionnaire-9 (PHQ-9, depressive symptoms) were collected.
At the beginning, 43.5% of patients had depressive symptoms (WHO-5 > 28). After the 2 year follow-up the percentage of patients with depressive symptoms had reduced to 20.8%. Correlations with disease activity according to DAS28 and the function of HAQ could be confirmed. There was no correlation between depressive symptoms and anti-CCP status (p = 0.431) or duration from symptom onset to diagnosis (p = 0.671).
Screening of early arthritis patients for the presence of depressive symptoms is of essential importance. Patients seem to be at high risk of developing depressive symptoms especially at the beginning of the disease and when showing high disability and poor results on disease activity score (DAS28 and visual analog scale)."
114,30987884,2019-04-17,Is Palindromic Rheumatism a Pre-rheumatoid Arthritis Condition? Low Incidence of Rheumatoid Arthritis in Palindromic Rheumatism Patients Treated with Tight Control Strategy.,"Artritis reumatoide"", ""Disease-modifying anti-rheumatic drugs"", ""Fármacos antirreumáticos modificadores de la enfermedad"", ""Palindromic rheumatism"", ""Remisión"", ""Remission"", ""Reumatismo palindrómico"", ""Rheumatoid arthritis","Palindromic rheumatism (PR) is characterized by repetitive, afebrile episodes of acute arthritis and peri-arthritis. The aim of this study was considering the long-term outcomes of patients with PR who were treated with tight control strategy using Disease-modifying anti-rheumatic drugs (DMARDs).
We reviewed the charts of 106 patients diagnosed with PR who were referred to the Connective Tissue Diseases Research Center (CTDRC). We recruited all the patients diagnosed with PR according to the criteria of Hannonen. They visited the CTDRC clinic regularly and were treated with hydroxychloroquine and low dose prednisolone because of active episodes of PR. In cases that the attacks did not come under control in 3-6 months, methotrexate was added or replaced and the dose was increased up to 25mg/week. In resistant cases, sulfasalazine was added, followed by the addition of leflunomide and then azathioprine. Disease outcome was evaluated by getting complete or partial remission and prevention of disease evolution to rheumatoid arthritis (RA) or other inflammatory connective tissue diseases.
This study included 92 patients with PR who were treated with DMARDs. Attacks were controlled completely or partially in 76 (82.6%) patients. Medications free remission was obtained in 16.3% of the patients. RA developed in 8.7% of the patients. By multivariate logistic regression analysis, age ≤40 at disease presentation, non-adherence to therapy and PIP joints involvement were the only factors which independently predicted the risk of treatment failure.
Tight control strategy by using DMARDs may control PR and prevent disease progression to RA."
115,30911837,2019-03-27,[Osteoporosis-frequent comorbidity in patients with rheumatism].,"Bisphosphonates"", ""Bone mineral density"", ""Glucocorticoids"", ""Osteonecrosis of the jaw"", ""Rheumatoid arthritis","Osteoporosis is one of the most frequent comorbidities in inflammatory rheumatic diseases. The immune system is substantially involved in the regulation of bone homeostasis and chronic inflammatory diseases influence this equilibrium at several levels. Besides the immunologically mediated inflammatory activity, immobility and glucocorticoid treatment are further risk factors for osteoporosis. Diagnostic and therapeutic recommendations are based on the current guidelines for osteoporosis of the Governing Body on Osteoporosis (DVO). Monitoring of the risk factors and bone mineral density testing is meaningful in each patient with a newly diagnosed rheumatic disease. In the case of a T-score ≤-1.5 a specific drug treatment with bisphosphonates, teriparatide or denosumab should be started together with optimizing preventive measures, such as reduction of glucocorticoid dosage, calcium and vitamin D intake and life style modifications. The risk of osteonecrosis of the jaw (ONJ) in patients with osteoporosis is small; however, there appears to be a significant increase in multiple vertebral fractures after discontinuation of denosumab."
116,30694360,2019-01-30,[Promotion of physical activity for older patients with rheumatism : Characteristics of inflammatory rheumatic diseases against the background of physical activity recommendations].,"Medical counseling"", ""Older adults"", ""Patient-oriented approach"", ""Physical activity"", ""Treatment","Due to the wide range of positive effects and the clear evidence of effectiveness, physical activity is one of the most important treatments for inflammatory rheumatic diseases. Because of the frequent overlap of disease and age-related aspects in older patients, the implementation of the German national physical activity recommendations has to be checked and accompanied by physicians. To get the older patients in motion, a patient-centered approach is required that takes the individual health problem(s) and the current context of life into account. This article provides an overview of the activity-related characteristics of older patients with inflammatory rheumatic diseases. Against this background a simple strategy is provided for promoting physical activity during medical consultation, which takes the characteristics of older patients with rheumatism into consideration. In this way, physicians can integrate a targeted, resource and time-saving economic strategy into consultations that is in concordance with the national physical activity recommendations."
117,30671186,2019-01-24,Chikungunya Masquerading as Acute Rheumatism in an Omani Traveler.,"Arthralgia"", ""Chikungunya Virus"", ""Epidemics"", ""Oman"", ""Pakistan"", ""Rheumatism","Chikungunya is a mosquito-borne viral disease. It typically presents as an acute febrile illness associated with a varying degree of arthralgia and musculoskeletal sequelae. Cases of chikungunya have been reported from more than 40 countries in several continents. Chikungunya is often reported in travelers returning to non-endemic/epidemic countries. With increasing international travel, it is vital that clinicians in non-endemic areas are made aware of this rapidly spreading infection. Increasing international travel (for social, leisure, and business) between Oman and several chikungunya endemic countries including Pakistan may facilitate the introduction of chikungunya to Oman. We report the first imported case of chikungunya in an Omani traveler with a link to the current outbreak in Pakistan."
